A1: Sample Custom Number Formats
A2: Format Code | B2: Description | C2: Data with General Format | D2: Data with Custom Number Format
A4: 00000 | B4: Always displays 5 digits. Pads with leading | C4: 983 | D4: 983
B5: zeros if the number contains fewer than 5 digits. | C5: 23589 | D5: 23589
B6: This custom format is very useful when you | C6: 9856 | D6: 9856
B7: work with zip codes. | C7: 85632 | D7: 85632
A9: 0;-0;;@ | B9: Suppresses zeros in cells. | C9: 98 | D9: 98
B10: This format displays positive values (0) and | C10: 0 | D10: 0
B11: negative values (-0), hides zero values, and | C11: -9 | D11: -9
B12: displays text (@). | C12: 0 | D12: 0
C13: hello | D13: hello
A15: ;;;@ | B15: Suppresses numbers in cells. | C15: 98 | D15: 98
B16: This format hides positive, negative, and zero | C16: 0 | D16: 0
B17: values, and displays only text (@). | C17: -9 | D17: -9
C18: 0 | D18: 0
C19: hello | D19: hello
A21: [Black]General | B21: Suppresses errors in cells. | C21: =1/3 -> 0.33333333333333331 | D21: =1/3 -> 0.33333333333333331
B22: This format hides or displays positive, | C22: =5/0 -> #DIV/0! | D22: =5/0 -> #DIV/0!
A23: (the cells are also formatted | B23: negative, zero, and text values as black | C23: =NA() -> #N/A | D23: =NA() -> #N/A
A24: with a blue font) | B24: characters in the General format. | C24: =5/3 -> 1.6666666666666667 | D24: =5/3 -> 1.6666666666666667
B25: The text is formatted with a blue font | C25: =4/8 -> 0.5 | D25: =4/8 -> 0.5
B26: so that errors do not appear. The other
B27: values appear because the number format
B28: color overrides the font color for the cell.
A30: #.??? | B30: Lines numbers up with the decimal. | C30: 3.2559999999999998 | D30: 3.2559999999999998
B31: The ? code leaves a space for | C31: 5.2 | D31: 5.2
B32: insignificant zeros but does not | C32: 9.6519999999999992 | D32: 9.6519999999999992
B33: display them. | C33: 98.256799999999998 | D33: 98.256799999999998
A35: #, | B35: Displays numbers in thousands. | C35: 4058.34 | D35: 4058.34
B36: The comma is the thousands | C36: 52865 | D36: 52865
B37: placeholder. If you wish to display | C37: 236 | D37: 236
B38: the numbers in millions, use the | C38: 5502235623 | D38: 5502235623
B39: format #,, instead. | C39: 999555 | D39: 999555
A41: #,###,, "M" | B41: Displays numbers in millions. | C41: 32654236 | D41: 32654236
B42: The comma is the thousands | C42: 4563258963 | D42: 4563258963
B43: placeholder. The letter "M" is displayed | C43: 1235698516311 | D43: 1235698516311
B44: after each number. | C44: 22333666 | D44: 22333666
C45: 12345678 | D45: 12345678
A47: 0.00,, | B47: Represents numbers in millions. | C47: 1000000 | D47: 1000000
B48: This number format displays numbers | C48: 12000000 | D48: 12000000
B49: so that 1 represents one million. | C49: 12200000 | D49: 12200000
C50: 120000 | D50: 120000
A52: 0;[Red]"Error!";0;[Red]"Error!" | B52: Displays "Error!" in red for negative numbers | C52: 10 | D52: 10
B53: and text. | C53: hello | D53: Error!
B54: This format may be useful to alert users | C54: -10 | D54: -10
B55: that they entered invalid text in a cell. | C55: 0 | D55: 0
A57: 0.0° | B57: Displays numbers with the degree symbol. | C57: 32.63 | D57: 32.63
B58: The degree symbol uses the character | C58: 63.258000000000003 | D58: 63.258000000000003
B59: map code ALT+0176. | C59: 96.75 | D59: 96.75
C60: -5.36 | D60: -5.36
A62: 0.00 £ | B62: Displays numbers with the British pounds | C62: 100 | D62: 100
B63: symbol. | C63: 67.63 | D63: 67.63
B64: The pound symbol uses the character | C64: 0 | D64: 0
B65: map code ALT+0163. | C65: 9.63 | D65: 9.63
A67: 0.0_-;0.0- | B67: Displays the negative sign on the right side | C67: -5 | D67: -5
B68: of the number. | C68: -40.3 | D68: -40.3
B69: This format also pads space at the right | C69: 50 | D69: 50
B70: of a postive number so that the decimals line up. | C70: -10.99 | D70: -10.99
A72: @ | B72: Displays 5 spaces and then the text to | C72: this | D72: this
B73: give the appearance of a tab (or indent). | C73: is | D73: is
A74: (5 spaces, then @) | C74: a | D74: a
C75: test | D75: test
A77: @*- | B77: Shows text leaders. | C77: Apples | D77: Apples ---------------------------
B78: In a number format, the asterisk (*) | C78: Oranges | D78: Oranges -------------------------
B79: causes Microsoft Excel to repeat the next | C79: Bananas | D79: Bananas ------------------------
B80: character until the width of the column | C80: Pears | D80: Pears -----------------------------
B81: is filled. Text leaders are commonly used in | C81: Peaches | D81: Peaches ------------------------
B82: tables of contents. | C82: Plums | D82: Plums ----------------------------
C83: Grapes | D83: Grapes ---------------------------
A85: 0 "dollars and" .00 "cents" | B85: Displays a currency value with words. | C85: 20.36 | D85: 20.36
B86: This format displays the whole number | C86: 2.55 | D86: 2.55
B87: portion of the number followed by the | C87: 45.36 | D87: 45.36
B88: words "dollars and," followed by the fractional | C88: 69 | D88: 69
B89: portion of the number and the word "cents." | C89: 36.25 | D89: 36.25
C90: 1003.33 | D90: 1003.33
A92: 0"."00 | B92: Displays a value in hundreds. | C92: 2300 | D92: 2300
B93: The comma is used only for scaling | C93: 23 | D93: 23
B94: numbers in multiples of one thousand. Use | C94: 400 | D94: 400
B95: a number format with a decimal character | C95: 5000 | D95: 5000
B96: between the placeholders to display a | C96: -90 | D96: -90
B97: number as a multiple of 100 or 10 (0"."0). | C97: 0 | D97: 0.00